{
  "id": "r36s-clone-card",
  "name": "R36S clone — games card (internal firmware)",
  "cfw": "Stock internal firmware",
  "deviceFamily": "r36s-clone",
  "storageModes": [
    "roms_card_only"
  ],
  "romSchema": {
    "layout": "arkos_easyroms_root",
    "formatFs": "fat32",
    "volumeLabel": "ROMS",
    "biosFolder": "bios",
    "systems": [
      {
        "id": "gba",
        "folder": "gba",
        "extensions": [
          ".gba",
          ".zip"
        ],
        "datNamePattern": "^Nintendo - Game Boy Advance"
      },
      {
        "id": "snes",
        "folder": "snes",
        "extensions": [
          ".sfc",
          ".smc",
          ".zip"
        ],
        "datNamePattern": "^Nintendo - Super Nintendo"
      },
      {
        "id": "nes",
        "folder": "nes",
        "extensions": [
          ".nes",
          ".zip"
        ],
        "datNamePattern": "^Nintendo - Entertainment System"
      },
      {
        "id": "megadrive",
        "folder": "megadrive",
        "extensions": [
          ".md",
          ".gen",
          ".bin",
          ".zip"
        ],
        "datNamePattern": "^Sega - Mega Drive"
      },
      {
        "id": "gb",
        "folder": "gb",
        "extensions": [
          ".gb",
          ".zip"
        ],
        "datNamePattern": "^Nintendo - Game Boy(?! Advance| Color)"
      },
      {
        "id": "gbc",
        "folder": "gbc",
        "extensions": [
          ".gbc",
          ".zip"
        ],
        "datNamePattern": "^Nintendo - Game Boy Color"
      },
      {
        "id": "neogeo",
        "folder": "neogeo",
        "extensions": [
          ".zip"
        ],
        "datNamePattern": "^SNK - Neo Geo"
      },
      {
        "id": "pcengine",
        "folder": "pcengine",
        "extensions": [
          ".pce",
          ".cue",
          ".zip"
        ],
        "datNamePattern": "^NEC - PC Engine"
      },
      {
        "id": "gamegear",
        "folder": "gamegear",
        "extensions": [
          ".gg",
          ".zip"
        ],
        "datNamePattern": "^Sega - Game Gear"
      },
      {
        "id": "mastersystem",
        "folder": "mastersystem",
        "extensions": [
          ".sms",
          ".ms",
          ".zip"
        ],
        "datNamePattern": "^Sega - Master System"
      },
      {
        "id": "arcade",
        "folder": "arcade",
        "extensions": [
          ".zip"
        ]
      },
      {
        "id": "psx",
        "folder": "psx",
        "extensions": [
          ".chd",
          ".cue",
          ".bin",
          ".iso"
        ],
        "datNamePattern": "^Sony - PlayStation"
      }
    ]
  },
  "version": 3,
  "stockFingerprint": {
    "manualOnly": false,
    "source": "DTB names: the AeolusUX ArkOS-R3XS panel checker (https://aeolusux.github.io/ArkOS-R3XS/tools/dtbIdentify.htm) treats rk3326-evb-lp3-v12-linux.dtb as a clone file. rk3326-r36s-type4-linux.dtb is the clone active DTB named by this repo's ArkOS4Clone fixture in src-tauri/tests/fixtures/card.rs. Published sha256 8c4b6b738bfd5af9638db9c6e9a3ac49884ca4b773c4053a31d1a934b69246b0 is the hash dtbvault.com lists for rk3326-evb-lp3-v12-linux.dtb (board G80CA-MB V1.3-20251212, origin Original SD). The other sha256 values hash the synthetic fixture bytes in src-tauri/tests/fixtures/stock, not firmware. sizeBytes 0 matches any positive partition size; any other size must match exactly. Types and labels are the boot-plus-games shape of those fixture descriptors.",
    "variants": [
      {
        "device": "R36S clone",
        "screen": "V12 panel",
        "dtbs": [
          {
            "name": "rk3326-evb-lp3-v12-linux.dtb",
            "sha256": "a2470b6ed7b7b14416a3aa551d2a990e9e835c427a8e5c8ffcef467e805e09d9"
          }
        ],
        "partitions": [
          {
            "type": "0c",
            "label": "BOOT",
            "sizeBytes": 67108864
          },
          {
            "type": "0c",
            "label": "ROMS",
            "sizeBytes": 0
          }
        ]
      },
      {
        "device": "R36S clone",
        "screen": "V12 panel",
        "dtbs": [
          {
            "name": "rk3326-evb-lp3-v12-linux.dtb",
            "sha256": "8c4b6b738bfd5af9638db9c6e9a3ac49884ca4b773c4053a31d1a934b69246b0"
          }
        ],
        "partitions": [
          {
            "type": "0c",
            "label": "BOOT",
            "sizeBytes": 0
          },
          {
            "type": "0c",
            "label": "ROMS",
            "sizeBytes": 0
          }
        ]
      },
      {
        "device": "R36S clone",
        "screen": "Type 4 panel",
        "dtbs": [
          {
            "name": "rk3326-r36s-type4-linux.dtb",
            "sha256": "e0d1a9a86ecf23e1b1c3a534b9909e6edaaf090105e7024bc51b0eb249708479"
          }
        ],
        "partitions": [
          {
            "type": "0c",
            "label": "BOOT",
            "sizeBytes": 67108864
          },
          {
            "type": "0c",
            "label": "ROMS",
            "sizeBytes": 0
          }
        ]
      }
    ]
  }
}
